{
 "format": "W1-rect-transcript",
 "version": "1.0",
 "mode": "exclusion",
 "function": "zeta",
 "trust_label": "kernel-checked modulo displayed hypotheses H-ENCL and H-AP (producers untrusted)",
 "rect": {
  "sigma1": {
   "n": "3",
   "d": "5"
  },
  "sigma2": {
   "n": "9",
   "d": "10"
  },
  "T1": {
   "n": "100",
   "d": "1"
  },
  "T2": {
   "n": "101",
   "d": "1"
  }
 },
 "scales": {
  "K": "1000000000000000000000000000000",
  "A": "1000000000000"
 },
 "claimed_m": "0",
 "mesh": {
  "bottom": [
   {
    "n": "3",
    "d": "5"
   },
   {
    "n": "13",
    "d": "20"
   },
   {
    "n": "7",
    "d": "10"
   },
   {
    "n": "3",
    "d": "4"
   },
   {
    "n": "4",
    "d": "5"
   },
   {
    "n": "17",
    "d": "20"
   },
   {
    "n": "9",
    "d": "10"
   }
  ],
  "right": [
   {
    "n": "100",
    "d": "1"
   },
   {
    "n": "2001",
    "d": "20"
   },
   {
    "n": "1001",
    "d": "10"
   },
   {
    "n": "2003",
    "d": "20"
   },
   {
    "n": "501",
    "d": "5"
   },
   {
    "n": "401",
    "d": "4"
   },
   {
    "n": "1003",
    "d": "10"
   },
   {
    "n": "2007",
    "d": "20"
   },
   {
    "n": "502",
    "d": "5"
   },
   {
    "n": "2009",
    "d": "20"
   },
   {
    "n": "201",
    "d": "2"
   },
   {
    "n": "2011",
    "d": "20"
   },
   {
    "n": "503",
    "d": "5"
   },
   {
    "n": "2013",
    "d": "20"
   },
   {
    "n": "1007",
    "d": "10"
   },
   {
    "n": "403",
    "d": "4"
   },
   {
    "n": "504",
    "d": "5"
   },
   {
    "n": "2017",
    "d": "20"
   },
   {
    "n": "1009",
    "d": "10"
   },
   {
    "n": "2019",
    "d": "20"
   },
   {
    "n": "101",
    "d": "1"
   }
  ],
  "top": [
   {
    "n": "9",
    "d": "10"
   },
   {
    "n": "17",
    "d": "20"
   },
   {
    "n": "4",
    "d": "5"
   },
   {
    "n": "3",
    "d": "4"
   },
   {
    "n": "7",
    "d": "10"
   },
   {
    "n": "13",
    "d": "20"
   },
   {
    "n": "3",
    "d": "5"
   }
  ],
  "left": [
   {
    "n": "101",
    "d": "1"
   },
   {
    "n": "2019",
    "d": "20"
   },
   {
    "n": "1009",
    "d": "10"
   },
   {
    "n": "2017",
    "d": "20"
   },
   {
    "n": "504",
    "d": "5"
   },
   {
    "n": "403",
    "d": "4"
   },
   {
    "n": "1007",
    "d": "10"
   },
   {
    "n": "2013",
    "d": "20"
   },
   {
    "n": "503",
    "d": "5"
   },
   {
    "n": "2011",
    "d": "20"
   },
   {
    "n": "201",
    "d": "2"
   },
   {
    "n": "2009",
    "d": "20"
   },
   {
    "n": "502",
    "d": "5"
   },
   {
    "n": "2007",
    "d": "20"
   },
   {
    "n": "1003",
    "d": "10"
   },
   {
    "n": "401",
    "d": "4"
   },
   {
    "n": "501",
    "d": "5"
   },
   {
    "n": "2003",
    "d": "20"
   },
   {
    "n": "1001",
    "d": "10"
   },
   {
    "n": "2001",
    "d": "20"
   },
   {
    "n": "100",
    "d": "1"
   }
  ]
 },
 "segments": [
  {
   "reLo": "1816075818402884158047989885633",
   "reHi": "2775677028377464180359188690200",
   "imLo": "-417294361752775851967189019672",
   "imHi": "336168141346431986017365590405",
   "argLo": "-629686166",
   "argHi": "-629686165"
  },
  {
   "reLo": "1755272815419257974187360224388",
   "reHi": "2581266654010641023104988160938",
   "imLo": "-366533920977850697475350459569",
   "imHi": "273038096178026452657493241993",
   "argLo": "-606893992",
   "argHi": "-606893991"
  },
  {
   "reLo": "1699502147726363220910123770927",
   "reHi": "2411973461183737495394891020997",
   "imLo": "-323814752171745268590135824598",
   "imHi": "219830798828491141415269923050",
   "argLo": "-578216766",
   "argHi": "-578216765"
  },
  {
   "reLo": "1648477754187797090859825961621",
   "reHi": "2264351089445872507003571919126",
   "imLo": "-287780544812084363712208616488",
   "imHi": "174986874268512516751137595720",
   "argLo": "-544465517",
   "argHi": "-544465516"
  },
  {
   "reLo": "1601890782114879512028359847221",
   "reHi": "2135442755355049298282980478517",
   "imLo": "-257306311261651394254237438793",
   "imHi": "137198744066720920735206770426",
   "argLo": "-506555147",
   "argHi": "-506555146"
  },
  {
   "reLo": "1559422712776511670592454948690",
   "reHi": "2022709532245171603778670271264",
   "imLo": "-231458781191797075171781108430",
   "imHi": "105368914465528455822714260188",
   "argLo": "-465454201",
   "argHi": "-465454200"
  },
  {
   "reLo": "1595496324175182215252479037123",
   "reHi": "1911792295788665841993064006642",
   "imLo": "-310144727365199660445592043809",
   "imHi": "112689654239876076346579103170",
   "argLo": "-6215774464",
   "argHi": "-6215774463"
  },
  {
   "reLo": "1584882079863950345577011385877",
   "reHi": "1910773276415269882619807652557",
   "imLo": "-368602622545238150381430151394",
   "imHi": "34566180307128914273195347517",
   "argLo": "-6229587188",
   "argHi": "-6229587187"
  },
  {
   "reLo": "1561991513624947660372492471174",
   "reHi": "1905446830998805969651288843152",
   "imLo": "-426344097362858347399168071153",
   "imHi": "-42410377709471367989958037902",
   "argLo": "-6214042050",
   "argHi": "-6214042049"
  },
  {
   "reLo": "1530336964487995387020115864658",
   "reHi": "1893095301764625257887175566125",
   "imLo": "-482241127151083767549655929587",
   "imHi": "-116544067275926947111076306021",
   "argLo": "-6168808597",
   "argHi": "-6168808596"
  },
  {
   "reLo": "1491791063458287049157468958483",
   "reHi": "1872048570126465246484927168592",
   "imLo": "-536677754480059523066167608999",
   "imHi": "-186606374564410484579457593908",
   "argLo": "-6092910302",
   "argHi": "-6092910301"
  },
  {
   "reLo": "1448020794935903918681705868732",
   "reHi": "1842149622742996119442603858098",
   "imLo": "-589070288625988027088035382261",
   "imHi": "-249487608379241235176383691477",
   "argLo": "-5984689592",
   "argHi": "-5984689591"
  },
  {
   "reLo": "1399689362534305286974248119613",
   "reHi": "1803495178252691321136770516761",
   "imLo": "-640956753841870898884805720425",
   "imHi": "-303549511234428596528110542683",
   "argLo": "-5841748576",
   "argHi": "-5841748575"
  },
  {
   "reLo": "1347650081132337773103870017314",
   "reHi": "1757134253453021669636755717674",
   "imLo": "-687838269152890453161081491570",
   "imHi": "-351062810103178515606567394107",
   "argLo": "-5660863950",
   "argHi": "-5660863949"
  },
  {
   "reLo": "1293023918133490301371629021630",
   "reHi": "1703607685859514503647402757076",
   "imLo": "-727811304592130154613696642784",
   "imHi": "-392217446175925277956431015755",
   "argLo": "-5437874508",
   "argHi": "-5437874507"
  },
  {
   "reLo": "1236552111950582244042636935698",
   "reHi": "1643581179450161483493624375040",
   "imLo": "-760119415332008675789988366456",
   "imHi": "-427238106051403585026098489789",
   "argLo": "-5167540417",
   "argHi": "-5167540416"
  },
  {
   "reLo": "1176277163370764124205481817321",
   "reHi": "1580873133570745729137897277312",
   "imLo": "-786759567629003924709248147023",
   "imHi": "-452619980165883935024468398645",
   "argLo": "-4843375763",
   "argHi": "-4843375762"
  },
  {
   "reLo": "1115563113188566955723897598276",
   "reHi": "1514974508936910239187630710034",
   "imLo": "-808586477674547652333943293932",
   "imHi": "-467551526480103497588589779939",
   "argLo": "-4457461101",
   "argHi": "-4457461100"
  },
  {
   "reLo": "1056450699199938362500835853045",
   "reHi": "1445097926490175041126759258321",
   "imLo": "-823057110597614710740698753969",
   "imHi": "-473549547726646951497942412608",
   "argLo": "-4000253281",
   "argHi": "-4000253280"
  },
  {
   "reLo": "995421144634317121678113252966",
   "reHi": "1377046669692568617621802107532",
   "imLo": "-829510459505596118656883141969",
   "imHi": "-471820036233729544244360353447",
   "argLo": "-3460429533",
   "argHi": "-3460429532"
  },
  {
   "reLo": "931689061856819730429954438609",
   "reHi": "1314084188553419364599377952646",
   "imLo": "-825191273681936307192350798563",
   "imHi": "-464995398012301061184274438078",
   "argLo": "-2824838241",
   "argHi": "-2824838240"
  },
  {
   "reLo": "871837071242782528113999981204",
   "reHi": "1251227046454086684829139252576",
   "imLo": "-810959610428201488217572953275",
   "imHi": "-452602164859295465546483940840",
   "argLo": "-2078689621",
   "argHi": "-2078689620"
  },
  {
   "reLo": "817365624184168167780268040006",
   "reHi": "1189156528315629831654613818806",
   "imLo": "-790390433712140939464734656209",
   "imHi": "-432372992467015645756215726806",
   "argLo": "-1206218283",
   "argHi": "-1206218282"
  },
  {
   "reLo": "765680691136615929408535167559",
   "reHi": "1132099304066573969010875228064",
   "imLo": "-764665018371266670343433444133",
   "imHi": "-403444392178422871760835392523",
   "argLo": "-192197764",
   "argHi": "-192197763"
  },
  {
   "reLo": "715576530056697876728889818885",
   "reHi": "1083057865310955710811453850876",
   "imLo": "-733929659901362882518193265335",
   "imHi": "-367588004163337004848669864165",
   "argLo": "975121305",
   "argHi": "975121306"
  },
  {
   "reLo": "668411847763764611088647604173",
   "reHi": "1042475474444281674242190622401",
   "imLo": "-696223959774739506689765121774",
   "imHi": "-327677122275382253802194397336",
   "argLo": "2298905354",
   "argHi": "2298905355"
  },
  {
   "reLo": "613371827104198178809212944382",
   "reHi": "1009634686394484267848828567315",
   "imLo": "-713994190300809373912082909115",
   "imHi": "-308559179935969574948415583743",
   "argLo": "-9770190005",
   "argHi": "-9770190004"
  },
  {
   "reLo": "530680336369652643106397877403",
   "reHi": "991009328251614314784233831704",
   "imLo": "-787935832728710923775819236765",
   "imHi": "-319419975668623895530903719836",
   "argLo": "-11530389204",
   "argHi": "-11530389203"
  },
  {
   "reLo": "434311910556767123929114344432",
   "reHi": "970059595319646637798217812553",
   "imLo": "-872477416030317415296769186649",
   "imHi": "-329770223872802187904925988314",
   "argLo": "-13596099497",
   "argHi": "-13596099496"
  },
  {
   "reLo": "322021568140698828613833463655",